{
  "schema": "night-shift/follow-up@1",
  "id": "2026-09-26-b",
  "from_night": "2026-09-26-b",
  "created_at": "2026-09-26T15:47:11+03:00",
  "items": [
    {
      "id": "A1",
      "status": "done",
      "task": "T5",
      "title": "Sort the task list by newest first or by due date",
      "done_when": [
        "The task list offers a toggle between newest first and due date",
        "Due-date order puts the earliest due date first and tasks without a due date last",
        "Unit tests cover both orders, typecheck, lint and unit tests pass, committed"
      ],
      "kind": "decision",
      "question": "Tasks have no due date yet. Should I add one so the list can sort by it?",
      "decision": "a",
      "decision_label": "Add an optional due date, then the sort toggle",
      "owner_note": "Optional date only, no time. Keep the sort toggle simple.",
      "resolved": {
        "at": "2026-09-26T16:07:15+03:00",
        "by": "day"
      }
    }
  ]
}
